{
  "unit_id": "aize-development.bug-hunting",
  "unit_kind": "session",
  "unit_class": "template",
  "instance_policy": "multi",
  "lifecycle": "manual",
  "restart_policy": "never",
  "display_name": "AIze Bug Hunting",
  "description": "The canonical non-UI AIzeDevelopment unit that coordinates delegated implementation work, verification, and careful runtime cutover in the shared AIze codebase.",
  "enabled": true,
  "launcher": {
    "create_as_child": true,
    "resident_parent_session_id": "default",
    "default_label": "AIze Bug Hunting",
    "goal_text": "Operate as the canonical non-UI AIzeDevelopment parent session for implementation work routed out of Entrance. Keep the development workflow explicit: each concrete request should run in a delegated child task session, verification should happen against a separate port or isolated runtime before touching the active AIze runtime, and completed work should only cut over after a careful stop-and-migrate step from the currently running AIze system to the newly verified one. Maintain narrow, verifiable changes and keep service boundaries explicit.",
    "initial_prompt": "Operate as the canonical AIzeDevelopment coordinator for routed implementation work. This parent session owns the durable development workflow and audit trail, while concrete code changes belong in delegated child task sessions under this parent. Require child sessions to verify behavior against a separate port or isolated runtime before any cutover, and only replace the active AIze runtime after the new path has been checked and the transition can be done carefully. Treat Entrance as IO/management only and keep architecture decisions aligned with MINIX-style service boundaries.",
    "preferred_provider": "codex",
    "selected_agents": [
      "codex_pool"
    ],
    "session_group": "root",
    "session_ui_mode": "standard",
    "session_permissions": {
      "create_session": true,
      "create_child_session": true,
      "update_session_goal": true,
      "update_goal": true,
      "send_user_prompt": true,
      "send_prompt": true,
      "auto_spawn_recovery": true,
      "auto_resume": true
    },
    "goal_completion_policy": "standard",
    "workspace_scope": "unit",
    "auto_select_session": true,
    "auto_send_initial_prompt": false,
    "skills": [
      {
        "skill_id": "aize-development-session",
        "kind": "development",
        "title": "AIze Development Session",
        "description": "Canonical delegated child-session guidance for AIze implementation work under the persistent AIzeDevelopment parent workflow.",
        "canonical_session_key": "aize.development",
        "when_to_use": "Use this skill for concrete implementation tasks delegated by routing skills, especially code edits, debugging, refactoring, and targeted test work that must not continue inside Entrance or stay in the AIzeDevelopment parent coordinator.",
        "usage": "Treat the session goal, the parent AIzeDevelopment workflow, and this skill text as the operating contract for the task. Implement the requested change here, verify it against a separate port or isolated runtime before any cutover, keep service ownership explicit, and report the concrete outcome so the parent session can manage careful migration of the active AIze runtime.",
        "prompt": "Use this session as a delegated child task under the canonical AIzeDevelopment parent workflow. Prefer narrow fixes, keep service ownership explicit, validate changes against a separate port or isolated runtime before reporting completion, and do not continue implementation inside Entrance or collapse the workflow back into the parent coordinator.",
        "files": [
          {
            "path": "README.md",
            "description": "High-level operating contract for the bug-hunting session.",
            "content": "# AIze Development Unit\n\nThis unit is the canonical non-UI AIzeDevelopment parent workflow for routed implementation work.\n\nGuidelines:\n- Keep the parent session focused on coordination, audit trail, and workflow discipline.\n- Run concrete code changes in delegated child task sessions.\n- Prefer focused fixes over broad rewrites.\n- Keep service boundaries explicit and observable.\n- Verify on a separate port or isolated runtime before claiming completion.\n- Only cut over after the currently running AIze runtime can be stopped and the verified runtime can be migrated carefully.\n- Treat Entrance as IO/management only; implementation routed from Entrance belongs in delegated child sessions under this parent.\n"
          },
          {
            "path": "message-system-checklist.md",
            "description": "Checks for message-system and routing changes.",
            "content": "# Message-System Checklist\n\n1. Confirm sender/receiver ownership is explicit.\n2. Avoid hidden routing heuristics when an explicit setting can carry intent.\n3. Preserve compatibility only at edges; keep internal state canonical.\n4. Verify runtime status, goal state, and UI refresh paths with focused tests.\n"
          },
          {
            "path": "development-cycle.md",
            "description": "Workflow contract for delegated AIze development and runtime cutover.",
            "content": "# AIze Development Cycle\n\n1. Route implementation requests from Entrance into this AIzeDevelopment parent session.\n2. Materialize each concrete request as a delegated child task session under the parent.\n3. Implement and verify the change against a separate port or isolated runtime first.\n4. Record the verification result before touching the active AIze runtime.\n5. Stop the currently running AIze runtime only when the replacement has been verified.\n6. Migrate carefully to the newly verified runtime and report any exact blocker if cutover is not safe.\n"
          }
        ]
      },
      {
        "skill_id": "unit-file-migration-audit",
        "kind": "audit",
        "title": "Unit Migration Audit",
        "description": "Audit and finish public-facing App and SessionTemplate migration while preserving compatibility shims where required.",
        "prompt": "Treat legacy App and SessionTemplate names as compatibility aliases only. New user-facing descriptors, tests, docs, and UI language should prefer Unit terminology.",
        "files": [
          {
            "path": "migration-audit.md",
            "description": "Checklist for legacy App terminology.",
            "content": "# Unit Migration Audit\n\nAudit scope:\n- Public UI strings should say Unit.\n- New descriptors should use `unit.json` first.\n- Legacy `session-templates/*/session-template.json`, `apps/*/app.json`, and `plugin_app_v1.json` are compatibility inputs only.\n- Compatibility behavior must stay tested while primary flows stop depending on old names.\n"
          }
        ]
      }
    ]
  }
}
