{
  "unit_id": "aize-development.system-diagnostics",
  "unit_kind": "session",
  "unit_class": "session",
  "instance_policy": "multi",
  "lifecycle": "auto",
  "restart_policy": "schedule",
  "display_name": "AIze System Diagnostics",
  "description": "Hourly Root-level diagnostics unit that inspects unfinished AIze sessions for pending user input, incomplete goals, and sessions that appear stopped or stuck.",
  "enabled": true,
  "launcher": {
    "create_as_child": true,
    "default_label": "AIze System Diagnostics",
    "goal_text": "Run an hourly Root-level diagnostics pass over AIze sessions. Inspect unfinished sessions, unprocessed user input, incomplete goals, and sessions that appear stopped or stuck, then record concrete findings and blockers as system diagnostics.",
    "initial_prompt": "Operate as the hourly AIze system-diagnostics session under Root. First run `PYTHONPATH=./src python3 -m runtime.system_monitor --runtime-root ./.aize-runtime --json` from the repo root. Inspect AIze runtime state for unfinished sessions, unprocessed user inputs, incomplete goals, stopped or stuck sessions, and recent restart health. Reuse existing state and diagnostics surfaces before inventing new checks: session pending-input files, pending-input queues, goal-audit state and history, session/child-session metadata, and `python3 scripts/diagnostics/probe_restart.py` when restart health needs direct evidence. Do not ask the user for feedback. Record concise findings, affected session IDs, evidence paths or event names, actions taken, tests/checks run, and exact blockers in the unit workspace.",
    "preferred_provider": "codex",
    "selected_agents": [
      "codex_pool"
    ],
    "session_group": "root",
    "session_ui_mode": "standard",
    "goal_completion_policy": "standard",
    "workspace_scope": "unit",
    "auto_select_session": true,
    "auto_send_initial_prompt": false,
    "schedule": {
      "enabled": true,
      "kind": "interval",
      "every_hours": 1,
      "timezone": "UTC"
    },
    "skills": [
      {
        "skill_id": "aize-system-diagnostics-hourly-audit",
        "kind": "diagnostics",
        "title": "AIze Hourly System Diagnostics",
        "description": "Root-level diagnostics pass for pending inputs, incomplete goals, stopped or stuck sessions, child-session state, and restart health.",
        "canonical_session_key": "aize.system-diagnostics",
        "prompt": "Run an evidence-backed AIze system diagnostics pass. Prefer repo and runtime state already maintained by AIze: pending-input queues, goal-audit records, session settings, child-session lineage, restart probe reports, and service history events. Keep findings concrete and preserve exact blockers.",
        "files": [
          {
            "path": "README.md",
            "description": "Operating contract for the hourly diagnostics Unit.",
            "content": "# AIze System Diagnostics Unit\n\nThis unit runs hourly as a child of the Root session.\n\nCadence:\n- Run every hour through the unit interval schedule.\n- Start each pass by reading this workspace's previous records.\n- Inspect unfinished sessions, unprocessed user input, incomplete goals, and sessions that appear stopped or stuck.\n- Use existing AIze state and diagnostics surfaces before adding ad hoc checks.\n\nEvidence sources:\n- Session pending-input queues.\n- Goal-audit state and goal history events.\n- Session and child-session metadata.\n- Restart diagnostics from `python3 scripts/diagnostics/probe_restart.py` when restart health matters.\n\nRecord one entry per run in `diagnostics-log.md` with findings, evidence, checks run, actions taken, and exact blockers.\n"
          },
          {
            "path": "diagnostics-log.md",
            "description": "Durable hourly diagnostics ledger.",
            "content": "# Diagnostics Log\n\nAppend one entry per run:\n\n- Date/time:\n- Session:\n- Sessions inspected:\n- Unprocessed user input findings:\n- Incomplete goal findings:\n- Stopped or stuck session findings:\n- Restart/health checks:\n- Actions taken:\n- Tests/checks run:\n- Blockers:\n"
          }
        ]
      }
    ]
  }
}
