{
  "unit_id": "entrance.service",
  "template_id": "aize-entrance",
  "unit_kind": "interface",
  "unit_class": "service",
  "instance_policy": "singleton",
  "lifecycle": "on_demand",
  "restart_policy": "on_failure",
  "display_name": "Entrance",
  "description": "An InterfaceUnit and SessionUnit pair that receives user feedback first and has its agent forward it to the appropriate AIze SessionUnit as a UserPrompt.",
  "enabled": true,
  "interfaces": {
    "web": "/units/entrance"
  },
  "endpoints": {
    "ipc": "unit://entrance.service/inbox"
  },
  "communication": {
    "enabled": true,
    "role": "user_dialogue",
    "response_policy": "respond_immediately_then_route_when_needed",
    "routing_policy": "route_unhandled_work_to_canonical_session",
    "fallback_policy": "ask_a_short_clarifying_question_only_when_target_cannot_be_inferred"
  },
  "launcher": {
    "create_as_child": true,
    "default_label": "Entrance",
    "goal_text": "Operate as the AIze Entrance IO/management layer only. Keep the session focused on direct user communication, target selection, routing, and status reporting. Answer lightweight questions quickly, infer the target SessionUnit from context when possible, submit the user's input as a UserPrompt on their behalf, and report routing status back to the user. Never perform implementation work, edits, debugging, or other goal completion inside Entrance itself. If a task needs real work, route it through a unit/session skill into the proper delegated SessionUnit and do not continue the implementation locally in Entrance. Do not create ad hoc implementation, debug, audit, or verification services directly under Entrance; those must be finite child SessionUnits under the routed parent and must be closed or marked complete when the requested work is done or blocked. Keep the goal active until the communication layer is explicitly retired.",
    "initial_prompt": "You are the AIze Entrance IO/management layer only. This session exists to communicate with the user and route user feedback or requests to the appropriate SessionUnit. Keep replies concise and operational. Answer simple questions directly, ask a short clarifying question only when the target SessionUnit cannot be inferred, and otherwise forward the user's input to the best matching SessionUnit as a UserPrompt on their behalf. Track whether the routed input reached the target and explain the current status to the user. Do not do implementation work, editing, debugging, or worker-style task execution inside Entrance. Implementation must happen in delegated sessions created or selected by session skills; after routing, do not continue the implementation locally in Entrance. Do not spawn debug, audit, or verification services under Entrance for work-bearing prompts. When a routed child finishes or is blocked, report that terminal state instead of leaving a new in-progress work session under Entrance. Do not mark the Entrance goal complete just because you answered or routed one message.",
    "preferred_provider": "codex",
    "selected_agents": [],
    "session_group": "user",
    "session_ui_mode": "communication",
    "session_interactive": true,
    "communication_agent_enabled": true,
    "goal_completion_policy": "continuous",
    "communication_agent_priority": [
      {
        "provider": "codex",
        "profile": "interactive-fast",
        "model": "gpt-5.4-mini",
        "session_slot": "interactive_agent",
        "session_mode": "ephemeral",
        "ephemeral": true
      }
    ],
    "skills": [
      {
        "skill_id": "entrance-lightweight-response",
        "kind": "interactive",
        "skill_scope": "unit",
        "title": "Entrance Lightweight Response",
        "description": "Code-based Entrance response handler for lightweight status/help/ping messages. Declines work-bearing prompts so skill-based routing can delegate implementation outside Entrance.",
        "routing_mode": "handle_user_message",
        "handler_file": "entrance_lightweight_response.py",
        "files": [
          {
            "path": "entrance_lightweight_response.py",
            "description": "Small distributable interactive handler for immediate Entrance replies.",
            "content": "def handle(context):\n    text = str(context.get('prompt_text') or '').strip()\n    normalized = ' '.join(text.lower().split())\n    if not normalized:\n        return {'handled': True, 'assistant_text': 'Send a message and I will route it to the right session when needed.'}\n    if normalized in {'ping', 'hello', 'hi', 'help', 'status'} or normalized.startswith('status '):\n        return {'handled': True, 'assistant_text': 'Entrance is active as IO/management only. Lightweight messages can be answered here; work requests are routed by skill to delegated sessions.'}\n    return {'handled': False}\n"
          }
        ]
      },
      {
        "skill_id": "canonical-development-routing",
        "kind": "routing",
        "skill_scope": "unit",
        "title": "Canonical Development Routing",
        "description": "Route implementation requests into the canonical non-UI AIzeDevelopment parent Unit, which stays under Root, keeps the development-cycle goal, and materializes each concrete request as a delegated child session under that parent.",
        "routing_mode": "create_child_session",
        "allow_tag_routing": false,
        "route_when_unhandled": false,
        "canonical_session_key": "aize.development",
        "target_unit_id": "aize-development.bug-hunting",
        "target_template_id": "aize-development.bug-hunting",
        "target_label": "AIze Development",
        "target_child_label": "AIze Development Task",
        "target_goal_text": "Operate as the canonical non-UI AIzeDevelopment parent session for implementation work routed out of Entrance. This session is a child of the Root session and must remain subordinate to the Root session's overall goal. Treat the Root goal as the constitutional objective for the whole AIze tree, and treat every delegated development goal under this parent as a subordinate law-like subgoal that exists only to satisfy that higher goal. Keep the development workflow explicit: each concrete request should run in a delegated child task session, verification should happen against a separate port or isolated runtime before touching the active AIze runtime, and completed work should only cut over after a careful stop-and-migrate step from the currently running AIze system to the newly verified one. Maintain narrow, verifiable changes, keep service boundaries explicit, and keep implementation philosophy aligned with MINIX-style separation. Do not treat positive evidence alone as enough for GoalCompleted: require a negative regression check for neighboring promised behavior before closure, especially around goal-state UI, runtime-state UI, routing lineage, and permissions when those areas are touched. Keep only this parent resident; debug, audit, verification, and implementation children are finite and must be marked complete or blocked with evidence when their request is handled.",
        "preferred_provider": "codex",
        "selected_agents": ["codex_pool"],
        "spawn_session_skills": [
          {
            "skill_id": "aize-development-session",
            "kind": "development",
            "skill_scope": "unit",
            "title": "AIze Development Session",
            "canonical_session_key": "aize.development",
            "description": "Canonical delegated child implementation session for AIze development work routed out of Entrance through the persistent AIzeDevelopment parent workflow and Root-goal lineage.",
            "when_to_use": "Use this skill when the request requires real implementation work such as code edits, debugging, refactoring, or targeted test fixes. Do not keep that work inside Entrance or in the AIzeDevelopment parent coordinator.",
            "usage": "Treat this session as the delegated implementation workspace under the AIzeDevelopment parent workflow. Read the active goal and this skill guidance together, perform the code changes here, verify on a separate port or isolated runtime before any cutover, and report concrete results back without sending the implementation work back to Entrance. After code edits, record the behavior changed, files touched, verification run, and residual risk in ./doc/. This child remains a subordinate subgoal under the Root session's overall goal. This child is finite: once the requested work is implemented, verified, or blocked with evidence, mark the task complete instead of staying resident.",
            "prompt": "This session is a delegated AIze development child task under the canonical parent workflow routed out of Entrance by skill. It remains subordinate to the Root session's overall goal. Execute the requested changes here, verify them on a separate port or isolated runtime, and leave final stop-and-migrate coordination to the parent session. Before reporting completion, verify both the requested positive result and the negative side that adjacent promised behavior was not violated, especially for goal-state visibility, runtime-state visibility, routing lineage, and permissions when those surfaces were touched. After code edits, add or update a concise implementation log under ./doc/. Treat Session skills as durable session conventions and AdaptiveSkill content as reusable task code/procedures for repeated work; do not silently remove user-visible behavior. This task session is not resident; do not spawn additional debug/audit services unless explicitly delegated, and close or mark complete after reporting the concrete result or blocker."
          }
        ]
      }
    ],
    "workspace_scope": "unit",
    "auto_select_session": true,
    "auto_send_initial_prompt": false,
    "ui_url": "/units/entrance"
  }
}
