{
  "unit_id": "aize-development.minix-refactor",
  "unit_kind": "session",
  "unit_class": "template",
  "instance_policy": "multi",
  "lifecycle": "scheduled",
  "restart_policy": "schedule",
  "display_name": "AIze MINIX Refactor",
  "description": "Autonomous AIze Development child unit for periodic issue discovery, codebase crawling, incremental task routing into child sessions, and MINIX-style verification/reporting passes.",
  "enabled": true,
  "launcher": {
    "create_as_child": true,
    "parent_unit_id": "aize-development.bug-hunting",
    "default_label": "AIze MINIX Refactor",
    "goal_text": "Periodically inspect AIze, discover concrete issues, crawl unexplored code gradually, keep durable audit records, and route one small evidence-backed MINIX-style refactor/debug task per run through a child session with verification and reporting on a four-hour cadence.",
    "initial_prompt": "Operate as an autonomous audit-and-orchestration child under the canonical AIze Development Unit. Do not run inside Entrance; Entrance is IO/management only and implementation belongs in skill-created delegated sessions. Treat this session as the recurring coordinator for crawl, triage, routing, and record-keeping. Each run should: 1. read the persistent unit workspace records first; 2. choose a narrow codebase area not recently inspected; 3. discover concrete bugs, boundary violations, or refactoring risks and record them before implementation; 4. when evidence supports a fix, create at most one narrow child session under this session to perform the implementation work; 5. require that child session to run targeted verification or record an exact blocker and report completion back to this parent; 6. update the workspace records here with inspected paths, findings, delegated task scope, verification results, and next candidates; 7. when code changes are made, ensure a concise implementation log exists under ./doc/. Keep MINIX-style boundaries explicit: small services, explicit state, simple interfaces, no hidden text heuristics for core runtime behavior. Avoid broad rewrites and prefer tiny, reviewable changes. Treat Session skills as durable conventions and AdaptiveSkill content as reusable repeated task code/procedures.",
    "preferred_provider": "codex",
    "selected_agents": [
      "codex_pool"
    ],
    "session_group": "user",
    "session_ui_mode": "standard",
    "goal_completion_policy": "standard",
    "workspace_scope": "unit",
    "child_session_sharing": {
      "mode": "private"
    },
    "auto_select_session": true,
    "auto_send_initial_prompt": false,
    "schedule": {
      "enabled": true,
      "kind": "interval",
      "every_hours": 4,
      "timezone": "UTC"
    },
    "skills": [
      {
        "skill_id": "aize-minix-incremental-refactor",
        "kind": "development",
        "title": "AIze MINIX Incremental Refactor",
        "description": "Autonomous four-hour audit/orchestration guidance with durable crawl, finding, delegation, change, and verification records.",
        "canonical_session_key": "aize.development.minix-refactor",
        "prompt": "Run autonomous incremental AIze maintenance as a child of the canonical AIze Development Unit, never inside Entrance. Persist records in the unit workspace before and after each pass. Use this scheduled session to audit, choose one narrow task, route implementation through a child session when a fix is warranted, and close the loop with verification and reporting. If code changes are made, ensure a concise implementation log is added or updated under ./doc/. Treat Session skills as durable conventions and AdaptiveSkill content as reusable repeated task code/procedures.",
        "files": [
          {
            "path": "README.md",
            "description": "Operating contract for the autonomous MINIX refactor Unit.",
            "content": "# AIze MINIX Refactor Unit\n\nThis unit runs as a scheduled child of the canonical AIze Development Unit.\n\nCadence:\n- Run every 4 hours through the unit schedule.\n- Start each pass by reading the records in this workspace.\n- Crawl a small, previously under-inspected area of the codebase.\n- Record inspected paths, findings, delegated tasks, verification, and blockers.\n- Prefer one small verified fix per run.\n\nExecution model:\n- This scheduled session is the coordinator and audit trail.\n- When a concrete fix is warranted, spawn one narrow child session for implementation.\n- Require the child session to run targeted verification and report completion back here.\n- Update the durable records after the child reports or a blocker is confirmed.\n\nBoundaries:\n- Do not work inside Entrance; Entrance is IO/management only.\n- Keep runtime behavior driven by explicit settings or persisted state.\n- Avoid text heuristics for core dispatch and service behavior.\n"
          },
          {
            "path": "crawl-record.md",
            "description": "Durable log of inspected code paths and next crawl candidates.",
            "content": "# Crawl Record\n\nAppend one entry per run:\n\n- Date/time:\n- Session:\n- Paths inspected:\n- Reason for choosing them:\n- Key observations:\n- Next candidates:\n"
          },
          {
            "path": "issue-ledger.md",
            "description": "Durable ledger of discovered issues, evidence, and status.",
            "content": "# Issue Ledger\n\nUse evidence-backed entries only:\n\n- ID:\n- Status: open | fixed | blocked | deferred\n- Evidence:\n- Affected paths:\n- Proposed smallest fix:\n- Verification:\n"
          },
          {
            "path": "change-log.md",
            "description": "Durable record of edits and verification from each run.",
            "content": "# Change Log\n\nAppend one entry per run:\n\n- Date/time:\n- Files changed:\n- Behavior changed:\n- Tests run:\n- Result:\n- Blockers:\n"
          },
          {
            "path": "delegation-log.md",
            "description": "Durable record of implementation child sessions and their verification/reporting outcomes.",
            "content": "# Delegation Log\n\nAppend one entry per delegated implementation run:\n\n- Date/time:\n- Parent audit session:\n- Child session:\n- Task delegated:\n- Files expected in scope:\n- Verification required:\n- Verification result:\n- Completion report summary:\n- Follow-up:\n"
          }
        ]
      }
    ]
  }
}
